{
  "schema": "openclaw.agent_room.telegram_group_ingress.v0",
  "event_id": "tg-ingress-openclaw-evolution-20260520-001",
  "event_type": "bot_invited",
  "chat_id": "-1009000000001",
  "chat_title": "openclaw??",
  "telegram_message_id": null,
  "actor_user_id": "100000001",
  "agent_candidates": [
    {
      "agent_id": "openclaw-main",
      "bot_username": "lchopenclaw_bot",
      "adapter_verified": true,
      "routing_ready": true,
      "status": "active"
    },
    {
      "agent_id": "claude-code",
      "bot_username": null,
      "adapter_verified": true,
      "routing_ready": true,
      "status": "active"
    },
    {
      "agent_id": "antigravity",
      "bot_username": null,
      "adapter_verified": true,
      "routing_ready": false,
      "status": "candidate_blocked_same_runid_roundtrip_missing"
    }
  ],
  "created_at": "2026-05-20T03:28:00+08:00",
  "room_binding_action": "add_participant",
  "room_id": "telegram--1009000000001-openclaw-evolution",
  "room_root": "agent-room/rooms/telegram--1009000000001-openclaw-evolution",
  "idempotency_key": "telegram-chat--1009000000001",
  "canonical_state_advanced": true,
  "side_effect_gate_status": "closed",
  "telegram_projection_status": "suppressed",
  "blocked_reason": null,
  "existing_room_id": "telegram--1009000000001-openclaw-evolution",
  "created_new_room": false,
  "participant_delta": {
    "added": [
      "claude-code"
    ],
    "removed": [],
    "blocked": [
      "antigravity"
    ]
  }
}
